Analysis_Source	Name (extracted)	Citing Article	Citied Article	Features	Name_Variants	Homepage_URL
citing_context	CCDDB	https://doi.org/10.1117/1.JEI.33.2.023030 (2024)	https://doi.org/10.1007/s11042-022-13925-6 (2022)	The CCDDB dataset is used for image augmentation in plant disease diagnosis, specifically by expanding the dataset through horizontal and vertical flipping. This enhances model training, improving the accuracy and robustness of machine learning models in diagnosing plant diseases. The dataset's ability to generate additional training images through augmentation is a key feature that enables more effective research in this area.		
cited_context	CCL'20	https://doi.org/10.3390/s23208519 (2023)	https://doi.org/10.1016/j.compag.2021.106658 (2022)	The CCL'20 dataset is used to train and evaluate object detection models for early-stage citrus leaf disease prediction. It focuses on achieving high accuracy through detailed annotations, enabling researchers to develop robust models for early disease identification. The dataset's detailed annotations are crucial for enhancing model performance and reliability in detecting specific diseases on citrus leaves.		
cited_context	CIFAR-10	https://doi.org/10.1007/s11042-022-14004-6 (2022)	https://doi.org/10.1109/ACCESS.2018.2844405 (2018)	The CIFAR-10 dataset is primarily used to train and evaluate deep convolutional neural networks for image classification tasks. Specifically, it has been adapted for maize leaf disease identification, where researchers employ the dataset to develop and test models that can accurately classify different types of maize leaf diseases. This adaptation leverages the dataset's diverse image set to enhance model robustness and accuracy in agricultural applications.		
cited_context	citrus dataset	https://doi.org/10.1109/ACCESS.2021.3096895 (2021)	https://www.semanticscholar.org/paper/3e2da7c1c7dfc7960d1515b61f32fdc55359eea7 (2015)	The citrus dataset is used to train and test machine learning models for diagnosing citrus diseases through image recognition, supporting the development of mobile disease diagnostics. It is also utilized to evaluate the performance of KNN algorithms in citrus leaf classification, addressing accuracy discrepancies in previous studies. This dataset enables researchers to improve disease identification and validate machine learning approaches in plant health monitoring.		
citing_context	Citrus 199 Leaves	https://doi.org/10.46604/ijeti.2021.8244 (2021)	https://doi.org/10.1016/j.compag.2017.04.008 (2017)	The 'Citrus 199 Leaves' dataset is used for symptom-based automated detection of citrus diseases. Researchers apply color histogram and textural descriptors in conjunction with machine learning algorithms to achieve high sensitivity in disease identification. This dataset enables the development and validation of models that can accurately diagnose citrus diseases, enhancing early detection and management strategies.		
cited_context	COCO	https://doi.org/10.3390/SYM11070939 (2019)	https://doi.org/10.1007/978-3-319-10602-1_48 (2014)	The COCO dataset is primarily used to evaluate state-of-the-art object detection architectures by establishing performance baselines for common objects in context. It is also utilized to train, validate, and test models for plant disease diagnosis, with data splits of 70% for training, 20% for validation, and 10% for testing. This versatile dataset supports both general object detection and specialized applications in plant health.		
cited_context	dataset collected from a real environment where crop was grown in a university research farm Koont	https://doi.org/10.3389/fpls.2023.1079366 (2023)	https://doi.org/10.3390/APP11114758 (2021)	The dataset from the university research farm Koont is used to train and evaluate YOLO models for detecting pests or diseases in crops. It focuses on real-world conditions and accuracy in a controlled agricultural setting, enabling researchers to assess model performance in practical scenarios.		
citing_context	dataset comprised of 40 images of each class	https://doi.org/10.1109/CISES54857.2022.9844374 (2022)	https://doi.org/10.1109/ICICI.2017.8365305 (2017)	The dataset, comprising 40 images per class, is used to train and evaluate computer vision models for detecting rice leaf diseases. It focuses on texture and color descriptors to develop accurate disease detection algorithms, enabling researchers to enhance the precision of plant disease diagnosis through image analysis.		
cited_context | citing_context	dataset consisting of 54,306 images of diseased and healthy plant leaves	https://doi.org/10.3906/ELK-1809-181 (2019)	https://doi.org/10.3389/fpls.2016.01419 (2016)	The dataset of 54,306 images of diseased and healthy plant leaves is used to train and evaluate deep learning models for image-based plant disease detection. It focuses on distinguishing between diseased and healthy leaves, enabling researchers to develop more accurate diagnostic tools. The large and diverse image set supports robust model training and validation.		
cited_context	dataset containing 609 samples	https://doi.org/10.1109/CVPR.2019.00899 (2019)	https://www.semanticscholar.org/paper/2a6b390610ff9cbc17c4cc00b05c2ce62e3b5352 (2012)	The dataset containing 609 samples is used to train and test artificial neural networks for diagnosing 8 tea insect pests. The focus is on feature selection and improving classification accuracy. This dataset enables researchers to develop and validate models that can accurately identify specific pests, enhancing pest management strategies in tea cultivation.		
citing_context	cotton leaf disease dataset	https://doi.org/10.3390/plants14132082 (2025)	https://doi.org/10.1016/j.dib.2024.110913 (2024)	The cotton leaf disease dataset is used to enhance the detection and classification of seven common cotton diseases. It employs 7000 samples derived from 2137 raw images, facilitating the development and evaluation of machine learning models for accurate disease identification. This dataset supports research aimed at improving the precision and efficiency of cotton disease diagnosis.		
cited_context	crop disease leaves image data set	https://doi.org/10.1109/ACCESS.2021.3052769 (2021)	https://doi.org/10.1016/j.compag.2015.08.027 (2015)	The 'crop disease leaves image data set' is used to verify models for crop disease diagnosis by comparing their performance against state-of-the-art segmentation algorithms. This dataset enables researchers to evaluate and refine diagnostic models, focusing on the accuracy and effectiveness of segmentation techniques in identifying diseased leaf areas.		
cited_context	Cropped-PlantDoc	https://doi.org/10.1145/3371158.3371196 (2019)	https://www.semanticscholar.org/paper/5d90f06bb70a0a3dced62413346235c02b1aa086 (2009)	The Cropped-PlantDoc dataset is used to evaluate the performance of CNN architectures on plant disease diagnosis, specifically focusing on image classification accuracy. It is employed in a specialized agricultural context to assess how effectively these models can diagnose plant diseases from images, enabling researchers to improve the precision and reliability of automated disease detection systems.		
citing_context	cucumber disease dataset	https://doi.org/10.3389/frai.2023.1227950 (2023)	https://doi.org/10.1016/j.compag.2017.04.013 (2017)	The cucumber disease dataset is primarily used to train and validate deep convolutional neural network (DCNN)-based systems for detecting cucumber diseases through symptom segmentation. The dataset includes image transformations for data augmentation, enhancing model robustness. It is typically split into training and validation sets (80:20 or 70:10:20), focusing on identifying common diseases. This approach supports the development of accurate disease recognition models.		
cited_context	Customized 50 Images / 2 Class Controlled Environment Cucumbers Multispectral	https://doi.org/10.1016/j.compag.2021.106125 (2020)	https://doi.org/10.1007/978-3-030-10728-4_11 (2019)	The 'Customized 50 Images / 2 Class Controlled Environment Cucumbers Multispectral' dataset is used to train and evaluate machine learning models for agricultural applications. Specifically, it has been utilized to train a LeNet-based model for citrus pest recognition using RGB images and a U-Net model for cucumber disease segmentation using multispectral images, both in controlled environments. The dataset's controlled conditions and multispectral capabilities enable precise model training and evaluation for these specific tasks.		
cited_context	database containing simulated images of tomato plant leaves	https://doi.org/10.1109/IDCIoT59759.2024.10467525 (2024)	https://doi.org/10.1016/j.compag.2021.106279 (2021)	The dataset of simulated images of tomato plant leaves is used to train and evaluate machine learning models for detecting tomato plant diseases. It focuses on assessing the effectiveness of synthetic data in enhancing model performance, providing a controlled environment to test and refine algorithms without the need for real-world images.		
cited_context	database of 500 images captured from experimental rice fields of Heilongjiang Academy of Land Reclamation Sciences, China	https://doi.org/10.3390/s21144749 (2021)	https://www.semanticscholar.org/paper/995c5f5e62614fcb4d2796ad2faab969da51713e (2015)	The dataset of 500 images from experimental rice fields in Heilongjiang, China, is used to train and evaluate a Convolutional Neural Network (CNN) for classifying 10 different rice diseases. This approach achieves 95% accuracy, highlighting the dataset's utility in developing robust machine learning models for disease classification in rice crops.		
citing_context	database of black star disease, grey-spot disease, cedar rust disease of apples, and good leaves	https://doi.org/10.1109/ICMCSI64620.2025.10883631 (2025)	https://doi.org/10.1109/ICEICT51264.2020.9334214 (2020)	The dataset is used to train and validate models for identifying and categorizing apple leaf diseases, specifically black star, grey-spot, and cedar rust diseases, as well as healthy leaves. This involves employing machine learning methodologies to enhance the accuracy of disease classification, supporting research in automated plant disease diagnosis.		
cited_context	Dataset of images with plants and pests	https://doi.org/10.1088/1757-899X/1032/1/012053 (2021)	https://www.semanticscholar.org/paper/4456fb02346d36bed0152a8bfe32cdcab5e7b943 (2013)	The dataset of images with plants and pests is used to train and evaluate the K-means algorithm for identifying plant pests, focusing on image-based recognition and clustering techniques. This enables researchers to develop and refine methods for automated pest identification, enhancing the accuracy and efficiency of pest management systems.		
cited_context	Deep Nutrient Deﬁciency for Sugar Beet dataset	https://doi.org/10.3390/info12110474 (2021)	https://doi.org/10.3390/sym12071065 (2020)	The Deep Nutrient Deficiency for Sugar Beet dataset is primarily used to identify nutrient deficiency symptoms in sugar beet by training and testing various deep learning models. Despite its name, it has also been utilized in unrelated studies to diagnose apple tree leaf diseases, focusing on disease classification accuracy. The dataset's versatility in deep learning applications highlights its utility in both specific and broader plant health diagnostics.		
cited_context	Deng data set	https://doi.org/10.1016/j.ecoinf.2021.101515 (2021)	https://doi.org/10.1145/3065386 (2012)	The Deng data set is used for pest identification in plant disease diagnosis, employing a CNN with transfer learning using AlexNet to address the challenge of a small dataset size. This approach specifically enhances the accuracy of pest detection, leveraging the pre-trained layers of AlexNet to improve model performance despite limited data.		
cited_context	DiaMos 2021	https://doi.org/10.1109/ICOSEC54921.2022.9951943 (2022)	https://doi.org/10.3390/agronomy11112107 (2021)	The DiaMos 2021 dataset is used to diagnose and monitor plant diseases, particularly pear spot, curl, and slug damage, by employing high-resolution images. Researchers use these images to develop and validate diagnostic models, focusing on accurate disease identification and monitoring. The dataset's high-resolution imagery is crucial for capturing detailed symptoms, enabling precise analysis and enhancing the reliability of disease detection methods.		
cited_context	DiaMos plant field dataset	https://www.semanticscholar.org/paper/b74461a923beb76a5fd18f08cae4291bd4ef3127 (2023)	https://doi.org/10.3390/agronomy11112107 (2021)	The DiaMos plant field dataset is used to diagnose and monitor plant diseases, particularly in pear fruits and leaves. It focuses on assessing varying severity levels of leaf diseases. Researchers employ this dataset to develop and validate diagnostic models, enhancing the accuracy of disease identification and monitoring in agricultural settings.		
cited_context	Digi-pathos	https://doi.org/10.1109/ACCESS.2023.3240100 (2023)	https://doi.org/10.1186/s13104-018-3548-6 (2018)	The Digi-pathos dataset is primarily used for developing and evaluating visual plant disease detection systems, particularly focusing on Northern Leaf Blight in maize. It provides annotated field images for training and testing machine learning and deep learning models, enhancing accuracy in disease symptom recognition. The dataset supports research on model generalization across various plant diseases, emphasizing robustness and high accuracy in image-based classification.		
cited_context	digital image analysis and spectral reflectance data	https://doi.org/10.1145/1980422.1980454 (2011)	https://doi.org/10.1016/J.COMPAG.2005.11.004 (2006)	The digital image analysis and spectral reflectance data dataset is used to quantify damage by greenbugs in winter wheat. Researchers employ image and spectral data to assess pest impact and severity, focusing on the extent and intensity of damage. This dataset enables precise quantification and analysis, facilitating a deeper understanding of pest effects on crop health.		
cited_context	disease images and normal rice images	https://doi.org/10.1109/ICEICT51264.2020.9334214 (2020)	https://doi.org/10.23919/EECSI48112.2019.8976962 (2019)	The 'disease images and normal rice images' dataset is used to train and evaluate deep convolutional neural networks for recognizing 10 specific rice diseases through image-based classification. This dataset enables researchers to develop and test machine learning models that can accurately identify various rice diseases, enhancing the precision of plant disease diagnosis.		
cited_context	diseasetraining dataset	https://doi.org/10.1109/BigData47090.2019.9006567 (2019)	https://www.semanticscholar.org/paper/eb42cf88027de515750f230b23b1a057dc782108 (2014)	The 'diseasetraining dataset' is used to fine-tune pre-trained VGG-16 models for plant disease diagnosis, specifically enhancing model accuracy on particular disease classes. This dataset enables researchers to improve the performance of deep learning models by providing labeled images of plant diseases, facilitating more precise and reliable disease classification.		
citing_context	Diyala Pepper	https://doi.org/10.47831/mjpas.v3i1.121 (2025)		The Diyala Pepper dataset is used for diagnosing plant diseases and detecting pests in peppers and fruits. It contains 78 images of both healthy and affected specimens, enabling researchers to develop and test image recognition algorithms for disease and pest identification. This dataset supports the development of accurate diagnostic tools, enhancing agricultural management practices.		
citing_context	DS_apple	https://doi.org/10.34133/plantphenomics.0039 (2023)	https://doi.org/10.1016/J.SWEVO.2018.02.013 (2019)	The DS_apple dataset is primarily used to evaluate optimization algorithms for disease diagnosis and pest detection in various crops, including apples, grapes, coffee, corn, and Chinese chestnuts. It focuses on feature selection and classification performance to enhance diagnostic accuracy. The dataset's versatility in supporting cross-crop analysis makes it valuable for optimizing machine learning models across different plant diseases and pests.		
citing_context	DS_corn	https://doi.org/10.34133/plantphenomics.0039 (2023)	https://www.semanticscholar.org/paper/cf20e34a1402a115523910d2a4243929f6704db1 (2005)	The DS_corn dataset is used to evaluate optimization algorithms for accuracy in corn disease diagnosis, focusing on feature selection and classification performance. It is employed to assess the effectiveness of various algorithms in selecting relevant features and improving classification accuracy, contributing to the development of more efficient and accurate disease diagnostic systems.		
cited_context	elaf images for tomato and grapes	https://doi.org/10.1109/ICOSEC54921.2022.9951943 (2022)	https://www.semanticscholar.org/paper/eb42cf88027de515750f230b23b1a057dc782108 (2014)	The 'elaf images for tomato and grapes' dataset is used to train and evaluate a VGG 16 model for classifying leaf images as healthy or unhealthy, specifically for disease diagnosis in plants. This dataset enables researchers to focus on identifying plant diseases through image classification, enhancing the accuracy of diagnostic models.		
citing_context	FGVC8	https://doi.org/10.34133/plantphenomics.0054 (2023)	https://doi.org/10.1002/aps3.11390 (2020)	The FGVC8 dataset is used for classifying foliar diseases in plants, particularly apples, using high-quality RGB images. It supports machine learning models to improve disease recognition accuracy and fine-grained identification across 61 categories of 27 diseases in 10 plant species. This dataset enables researchers to develop and evaluate advanced image-based diagnostic tools for plant health assessment.		
cited_context	field images of maize annotated with disease symptoms	https://doi.org/10.1007/s13198-020-00972-1 (2020)	https://doi.org/10.1186/s13104-018-3548-6 (2018)	The dataset of field images of maize annotated with disease symptoms is used to train and validate systems for detecting and diagnosing maize diseases. Researchers employ deep learning techniques to focus on symptom identification in real-field images, enhancing the accuracy of disease detection models. This dataset enables the development and evaluation of robust diagnostic tools by providing a realistic and annotated data source.		
cited_context	field images of maize with Northern Leaf Blight (NLB) disease	https://doi.org/10.1109/WACV48630.2021.00201 (2021)	https://doi.org/10.1186/s13104-018-3548-6 (2018)	The dataset of field images of maize with Northern Leaf Blight (NLB) disease is used to train and evaluate deep learning frameworks for detecting and quantifying NLB symptoms. It focuses on phenotypic traits like the area and length of diseased regions and generates disease region and leaf instance masks to improve diagnosis accuracy. The dataset demonstrates the effectiveness of these frameworks in quantifying NLB symptoms in maize plants.		
citing_context	FieldPlant	https://doi.org/10.1109/ICCRTEE64519.2025.11053028 (2025)	https://doi.org/10.1109/ACCESS.2023.3263042 (2023)	The FieldPlant dataset is used to train and evaluate deep learning models for plant disease detection and classification, specifically focusing on field plant images. This enhances model robustness and accuracy by providing diverse and realistic data. The dataset's field-specific images are crucial for improving the performance of disease detection models in real-world conditions.		
cited_context | citing_context	dataset for the categorization of Pinus tree disease	https://doi.org/10.1109/ACCESS.2023.3284760 (2023)	https://doi.org/10.1016/j.asoc.2020.106597 (2020)	The dataset for the categorization of Pinus tree disease is used to develop a UAV-based system for disease classification in Pinus trees. It focuses on image acquisition and employs Bayesian deep learning for accurate disease categorization. This approach enables researchers to enhance the precision and efficiency of disease identification in forestry management.; The dataset for the categorization of Pinus tree disease is used to develop a UAV-based system for disease classification in Pinus trees. It focuses on image acquisition and employs Bayesian deep learning for accurate disease categorization. This methodology enables researchers to enhance the precision and efficiency of disease identification in forestry management.		
citing_context	dataset for three common grape leaf diseases and Mites of grape	https://doi.org/10.1007/978-3-031-06430-2_32 (2022)	https://doi.org/10.3389/fpls.2020.00751 (2020)	The dataset for three common grape leaf diseases and mites is used to train and evaluate deep-learning-based detectors, specifically focusing on real-time detection of grape leaf diseases and pests using improved convolutional neural networks. This enables researchers to develop more accurate and efficient methods for identifying and managing these issues in vineyards.		
cited_context	GAN based image augmented dataset	https://doi.org/10.3390/app12146982 (2022)	https://doi.org/10.1016/j.ifacol.2019.12.406 (2019)	The GAN-based image augmented dataset is used to enhance insect pest classification by augmenting training data, which improves the performance of deep convolutional neural network (DCNN) models in pest detection. This dataset specifically addresses the challenge of limited labeled data in pest detection, enabling more robust and accurate classification through data augmentation techniques.		
cited_context	GitHub	https://doi.org/10.1109/IBCAST51254.2021.9393311 (2021)	https://doi.org/10.1016/j.compag.2018.12.028 (2019)	The GitHub dataset is used to detect grapevine yellows symptoms in Vitis vinifera L. through image-based symptom identification. Artificial intelligence methodologies are employed to analyze images, enabling researchers to focus on the early detection and monitoring of plant diseases. This dataset supports the development and validation of AI models for symptom recognition, enhancing disease management strategies.		
cited_context	GPID-22	https://doi.org/10.48550/arXiv.2407.14911 (2024)	https://doi.org/10.1109/CVPR52688.2022.01553 (2021)	The GPID-22 dataset is used to pretrain self-supervised models for the purpose of comparing their performance in plant disease diagnosis or pest detection using image data. This dataset enables researchers to evaluate and enhance the effectiveness of self-supervised learning approaches in agricultural image analysis tasks.		
cited_context	grape leaf dataset	https://doi.org/10.3390/s22020575 (2022)	https://doi.org/10.1016/j.compag.2020.105712 (2020)	The grape leaf dataset is used to evaluate recall for true positive and false negative cases in disease detection of grape leaves. It focuses on data association across different classes, enabling researchers to assess the accuracy and reliability of disease classification methods. This dataset supports the development and testing of algorithms designed to improve the precision of grape leaf disease diagnosis.		
cited_context	grape leaf spot data	https://doi.org/10.1109/ACCESS.2021.3097050 (2021)	https://www.semanticscholar.org/paper/8388f1be26329fa45e5807e968a641ce170ea078 (2015)	The grape leaf spot data dataset is used for data augmentation in grape leaf spot disease diagnosis, specifically by applying Generative Adversarial Networks (GANs) to enhance the dataset's size and diversity. This methodology increases the robustness and generalizability of machine learning models, enabling more accurate diagnosis of grape leaf spot diseases.		
cited_context	GrapesNet	https://www.semanticscholar.org/paper/b74461a923beb76a5fd18f08cae4291bd4ef3127 (2023)	https://doi.org/10.1016/j.dib.2023.109100 (2023)	The GrapesNet dataset is used for training and evaluating deep learning models in vineyard settings, specifically focusing on color (RGB) and depth (RGB-D) images. It enables researchers to develop and test algorithms that can process and analyze vineyard imagery, enhancing applications such as crop monitoring and management. The dataset's provision of both color and depth data supports more robust model training and evaluation.		
cited_context	grapevine leaves dataset	https://doi.org/10.3389/fpls.2021.695749 (2021)	https://doi.org/10.1016/j.dib.2021.106809 (2021)	The grapevine leaves dataset is used for the early detection and classification of Esca disease in vineyards through machine learning, focusing on image-based diagnostics. This dataset enables researchers to develop and validate algorithms that can accurately identify Esca disease symptoms from leaf images, enhancing early intervention and management strategies in viticulture.		
cited_context	hill banana dataset	https://doi.org/10.3390/agriculture12010009 (2021)	https://www.semanticscholar.org/paper/2f49bbebd95eab84aec41dd82e021b84a2dddeba (2017)	The hill banana dataset is used for classifying leaf diseases in hill bananas through RFC-GLCM-based methods, focusing on image processing techniques. This dataset enables researchers to develop and test algorithms for disease detection, specifically addressing the classification of leaf diseases in hill bananas. The dataset's image-based features are crucial for these methodologies.		
cited_context	HuyDo 2019	https://doi.org/10.1016/j.eswa.2021.114770 (2021)		The HuyDo 2019 dataset is used to diagnose plant diseases in rice leaves by evaluating classification models. It consists of 2370 samples across multiple classes, including healthy plants. Researchers employ this dataset to assess the accuracy and effectiveness of various classification models in identifying specific diseases, thereby enhancing disease diagnosis in agricultural settings.		
