Analysis_Source	Name (extracted)	Citing Article	Citied Article	Features	Name_Variants	Homepage_URL
cited_context	1000 images of tomato leaves	https://doi.org/10.3390/plants9101302 (2020)	https://doi.org/10.1016/J.COMPAG.2019.104962 (2019)	The '1000 images of tomato leaves' dataset is used to develop and test image segmentation algorithms for identifying healthy and infected tomato leaves, particularly focusing on yellow leaf curl and mosaic virus. This dataset enables researchers to refine algorithms that accurately segment and classify leaf images, aiding in the precise detection of these specific plant diseases.		
citing_context	14,956 images with 38 distinct classes	https://doi.org/10.32996/jcsts.2023.5.3.6 (2023)	https://doi.org/10.1109/TENCON.2017.8228324 (2017)	The dataset of 14,956 images with 38 distinct classes is primarily used for training and evaluating models focused on plant disease diagnosis and leaf disease detection. Researchers employ various methodologies, including feature extraction and image processing techniques, deep learning architectures like VGGNet and AlexNet, and machine learning algorithms such as Random Forest and SVM. The dataset supports research on improving the accuracy and performance of classification models, particularly in the context of plant health monitoring and disease identification.		
cited_context	15,000 images of tomato leaf diseases	https://doi.org/10.1109/ACCESS.2020.2982443 (2020)	https://doi.org/10.1080/08839514.2017.1315516 (2017)	The dataset of 15,000 images of tomato leaf diseases is used to classify 9 specific tomato leaf diseases using the AlexNet deep learning model. This application demonstrates effective recognition performance, enabling researchers to advance deep learning-based plant disease diagnosis. The dataset's large size and diverse disease representation support robust model training and validation.		
cited_context	16,207 clean images	https://doi.org/10.1073/pnas.1716999115 (2018)		The dataset of 16,207 clean images is used to train and evaluate machine learning models for diagnosing plant diseases and conditions such as bacterial blight, brown spot, and potassium deficiency. This dataset enables researchers to develop and test algorithms that can accurately identify these specific plant health issues, enhancing the precision of disease diagnosis in agricultural settings.		
cited_context	16,652 images collected from Shandong Province, China	https://doi.org/10.3390/s21144749 (2021)	https://doi.org/10.1109/ACCESS.2019.2891739 (2019)	The dataset of 16,652 images from Shandong Province, China, is used for training and evaluating the M-bCNN model to achieve fine-grained image classification of wheat leaf diseases. This application focuses on enhancing the accuracy of disease diagnosis, with the model achieving 90% accuracy. The dataset's large size and specific focus on wheat leaf images enable robust model training and evaluation.		
cited_context	1796 images of maize leaves	https://doi.org/10.3390/s21144749 (2021)	https://doi.org/10.1094/PHYTO-11-16-0417-R (2017)	The dataset of 1796 images of maize leaves, sourced from the Musgrave Research Farm in Aurora, NY, is used to train Convolutional Neural Networks (CNNs) for identifying Northern Leaf Blight-infected maize plants. Research focuses on optimizing network architecture and hyperparameters to improve disease detection accuracy. This dataset enables the development and evaluation of machine learning models tailored for agricultural disease diagnosis.		
citing_context	18,161 plain as well as segmented tomato leaf images	https://doi.org/10.1109/ICSSIT53264.2022.9716233 (2022)	https://doi.org/10.3390/AGRIENGINEERING3020020 (2021)	The dataset of 18,161 plain and segmented tomato leaf images is used to train and evaluate a deep learning framework, specifically EfficientNet, for categorizing tomato diseases. Research focuses on enhancing the accuracy and reliability of disease detection by utilizing both plain and segmented images, thereby improving the robustness of disease classification models.		
cited_context	1969 RGB+NIR images	https://doi.org/10.3390/app12125919 (2022)	https://doi.org/10.5194/ISPRS-ANNALS-IV-2-W3-41-2017 (2017)	The 1969 RGB+NIR images dataset is used to detect sugar beet plants and weeds in agricultural fields. Employing CNNs with TensorFlow, the dataset, captured by a JAI camera on a UAV, is processed using NDVI for vegetation-background separation and blob segmentation. This methodology enables precise identification and differentiation of plants and weeds, enhancing precision agriculture practices.		
cited_context	2370 images	https://doi.org/10.3390/plants11172230 (2022)	https://www.semanticscholar.org/paper/4654aa505e5bcdb089d0df202cd7ceabc9d2d41f (2019)	The '2370 images' dataset is used to develop and evaluate plant disease diagnosis models, focusing on categorizing healthy leaves, leaf blasts, rice hispa damage, and brown spots. This dataset supports machine learning methodologies by providing labeled images for training and testing models, enabling accurate classification of plant health conditions.		
cited_context	2465 images of potato diseases	https://doi.org/10.1117/12.2680747 (2023)	https://doi.org/10.1094/PHYTO-08-18-0288-R (2019)	The dataset of 2465 images of potato diseases is used to train and evaluate a CNN-F algorithm for detecting potato diseases, specifically focusing on a limited number of disease categories. This approach enables researchers to improve the accuracy of disease detection in potatoes, contributing to more effective disease management strategies.		
citing_context	25,000 images of stressed and healthy leaves	https://doi.org/10.32604/iasc.2022.020679 (2022)	https://doi.org/10.1073/pnas.1716999115 (2018)	The dataset of 25,000 images of stressed and healthy leaves is used to train and evaluate deep machine vision models for detecting, classifying, and quantifying various soybean plant stresses. It focuses on image-based phenotyping, enabling researchers to analyze and understand the visual indicators of plant stress conditions. The dataset's large size and diverse range of stress types enhance the robustness and accuracy of the models.		
cited_context	3602 pictures of twelve common diseases	https://doi.org/10.1117/12.2680747 (2023)	https://doi.org/10.1109/ICCVW54120.2021.00312 (2021)	The dataset of 3602 pictures of twelve common diseases is used to train and evaluate the YOLOv5s network model for pest detection, specifically addressing the challenge of limited data in plant disease diagnosis. This dataset enables researchers to improve the accuracy and robustness of pest detection models, enhancing their applicability in real-world scenarios.		
citing_context	4000 images of Potato early blight, Tomato early blight, Potato late blight, and Tomato late blight	https://doi.org/10.47839/ijc.22.2.3088 (2023)	https://doi.org/10.1109/ETCCE51779.2020.9350890 (2020)	The dataset of 4000 images of Potato early blight, Tomato early blight, Potato late blight, and Tomato late blight is used to classify plant diseases, specifically focusing on early and late blight in potatoes and tomatoes. It provides a graphical layout for preventive measures, enabling researchers to develop and validate classification models that aid in disease identification and management.		
cited_context	500 images of 30 different native types of plants of Tamil Nadu	https://doi.org/10.3390/app12125919 (2022)	https://www.semanticscholar.org/paper/c03272f644ac84c6bd2b4486ddd81b27d9d77aca (2013)	The dataset of 500 images of 30 different native types of plants from Tamil Nadu is used for training and evaluating SVM models to detect and classify plant diseases. Images are resized to 32x32 pixels and converted to HSI format, enabling precise model training and evaluation for disease identification in these specific plant types.		
citing_context	5162 images	https://doi.org/10.1109/COMPAS60761.2024.10796774 (2024)	https://doi.org/10.1109/SMARTGENCON56628.2022.10083986 (2022)	The '5162 images' dataset is used to train and evaluate a Convolutional Neural Network (CNN) model for potato leaf disease detection. It classifies leaves into healthy, early blight, and late blight categories, achieving 98.07% accuracy. This dataset enables precise disease classification, supporting research in plant health monitoring and disease management.		
citing_context	54306 leaf images	https://doi.org/10.1109/LA-CCI58595.2023.10409445 (2023)	https://doi.org/10.3389/fpls.2016.01419 (2016)	The '54306 leaf images' dataset is used to train and evaluate Convolutional Neural Network (CNN) models for plant disease detection. It focuses on 14 crops and 26 classes, including healthy leaves. This dataset enables researchers to develop and test algorithms that can accurately identify various plant diseases, enhancing agricultural monitoring and management.		
cited_context	575 images made available by Barbedo (2019)	https://doi.org/10.1016/j.compag.2019.105162 (2019)	https://doi.org/10.1016/J.BIOSYSTEMSENG.2019.02.002 (2019)	The dataset of 575 images by Barbedo (2019) is used to augment existing datasets, enhancing the diversity and size of training sets for plant disease identification through deep learning. This augmentation improves model accuracy and robustness in recognizing various symptoms, thereby advancing the field of plant health monitoring and disease management.		
cited_context | citing_context	60,000 rice leaf photographs	https://doi.org/10.1109/ACCESS.2023.3284760 (2023)	https://doi.org/10.1016/J.COMPAG.2019.03.012 (2019)	The 60,000 rice leaf photographs dataset is used to train the AlexNet model for feature extraction, specifically for diagnosing rice diseases. This dataset enables researchers to achieve high accuracy (96.8%) in disease diagnosis, focusing on the identification and classification of rice leaf diseases through machine learning techniques. The large number of images provides a robust training set for model development.; The 60,000 rice leaf photographs dataset is used to train the AlexNet model for feature extraction, specifically to achieve high accuracy in classifying rice diseases. This deep learning approach focuses on enhancing the precision of disease identification through advanced image analysis techniques. The dataset's large size and diverse images enable robust training and validation of the model, facilitating accurate disease classification in rice leaves.		
cited_context	70,295 images	https://doi.org/10.1109/ICCICA60014.2024.10584860 (2024)	https://doi.org/10.1109/icacite51222.2021.9404647 (2021)	The dataset of 70,295 images is used to train and evaluate deep learning models for plant disease detection. It focuses on improving classification accuracy and addressing practical agricultural applications, enabling researchers to develop more effective methods for identifying plant diseases in real-world settings.		
cited_context	70,560 learning patches by the UAV system with an RGB sensor	https://doi.org/10.3390/s21144749 (2021)	https://doi.org/10.1016/J.COMPAG.2018.10.006 (2018)	The dataset of 70,560 learning patches captured by a UAV system with an RGB sensor is primarily used for detecting Esca disease in vineyards. Researchers employ methodologies such as LeNet-5 and vegetation indices (ExR, ExG, ExGR) with a (16 × 16) patch size, achieving up to 95% accuracy in image-based disease diagnosis. This dataset enables precise and efficient identification of vineyard diseases through unmanned aerial vehicle imagery.		
cited_context	800 images of cucumber leaves captured by Saitama Prefectural Agriculture and Forestry Research Center, Japan	https://doi.org/10.3390/s21144749 (2021)	https://doi.org/10.1007/978-3-319-27863-6_59 (2015)	The dataset of 800 cucumber leaf images is used to train and evaluate a Convolutional Neural Network (CNN) for diagnosing viral plant diseases, specifically Cucumber Melon Yellow Spot Virus (MYSV) and Zucchini Yellow Mosaic Virus (ZYMV). The research focuses on achieving high diagnostic accuracy, with an average accuracy of 94%, highlighting the dataset's utility in developing robust disease identification models.		
cited_context | citing_context	93 images of cucumber downy mildew	https://doi.org/10.1109/ACCESS.2023.3284760 (2023)	https://doi.org/10.1109/ACCESS.2020.3039345 (2020)	The '93 images of cucumber downy mildew' dataset is used to test image segmentation methods for detecting cucumber downy mildew, achieving 97.29% accuracy through morphological processes. This dataset enables researchers to evaluate and refine image processing techniques specifically for identifying downy mildew in cucumbers, contributing to the development of accurate disease detection systems.; The '93 images of cucumber downy mildew' dataset is used to test image segmentation methods for diagnosing cucumber downy mildew. Researchers employ morphological processes to achieve high accuracy (97.29%) in identifying the disease. This dataset enables the development and validation of image processing techniques specifically tailored for plant disease diagnosis.		
cited_context	985 images of corn northern blight and healthy corn leaf	https://doi.org/10.3390/agriculture12122047 (2022)	https://doi.org/10.1016/s2095-3119(21)63707-3 (2022)	The dataset of 985 images of corn northern blight and healthy corn leaves is used to train and expand datasets for diagnosing northern corn leaf blight through deep learning. Researchers focus on image augmentation techniques to enhance model performance, improving the accuracy and robustness of disease diagnosis models.		
cited_context	Aberystwyth leaf evaluation dataset (ALED)	https://doi.org/10.1155/2022/3287561 (2022)	https://www.semanticscholar.org/paper/6af9f16cab142e4ae7fc077d55b98258b71e358a (2019)	The Aberystwyth leaf evaluation dataset (ALED) is used to assess the performance of a shallow CNN and Canny edge detector for leaf segmentation. Research focuses on evaluating metrics such as Dice Coefficient (DIC), False Boundary Detection (FBD), and Split Boundary Detection (SBD). This dataset enables researchers to refine and compare segmentation techniques, enhancing accuracy in leaf boundary detection.		
cited_context	AC-I	https://doi.org/10.1016/J.COMPAG.2012.12.002 (2013)	https://doi.org/10.1016/J.COMPAG.2010.02.007 (2010)	The AC-I dataset is used to detect plant diseases from aerial images captured by aircraft and UAVs. It contains spectral features, ranging from six to thirteen, which are utilized to identify prominent variables associated with plant health. This dataset enables researchers to develop and validate algorithms for disease detection, enhancing precision agriculture practices.		
cited_context	AI Challenger	https://doi.org/10.1016/j.compag.2021.106125 (2020)	https://doi.org/10.1145/3371425.3371497 (2019)	The AI Challenger dataset is used to train and evaluate deep learning models for crop disease identification. It focuses on achieving high accuracy in recognizing various plant diseases, enabling researchers to develop robust models for agricultural health monitoring. The dataset's comprehensive labels and diverse image set support these methodologies, facilitating advancements in automated disease recognition.		
cited_context	ALDD	https://doi.org/10.1109/ACCESS.2019.2914929 (2019)	https://doi.org/10.1145/3065386 (2012)	The ALDD dataset is used to train and test deep convolutional networks, specifically for plant disease diagnosis or pest detection. Researchers compare the performance of these networks, including the proposed VGG-INCEP model, using this dataset. The dataset's images enable the evaluation of different models' accuracy and efficiency in identifying plant diseases and pests.		
cited_context	ALDOD testing set	https://doi.org/10.3389/fpls.2022.927424 (2022)	https://doi.org/10.1007/978-3-030-01234-2_1 (2018)	The ALDOD testing set is used to evaluate the performance of MGA-YOLO, specifically focusing on metrics such as average precision, detection speed, and model size. This dataset enables researchers to assess the effectiveness and efficiency of object detection models in various applications, providing a benchmark for comparing different algorithms.		
citing_context	An open access repository of images on plant health	https://doi.org/10.25081/ia.2023-04 (2023)	https://www.semanticscholar.org/paper/3e2da7c1c7dfc7960d1515b61f32fdc55359eea7 (2015)	The dataset is used to develop mobile disease diagnostics through machine learning and crowdsourcing, focusing on a wide range of plant diseases such as apple scab and black rot. It enables researchers to train algorithms for accurate disease identification, leveraging a diverse set of high-quality images. This approach enhances the capability of mobile applications to diagnose plant diseases effectively.		
cited_context | citing_context	apple disease dataset	https://doi.org/10.1109/ACCESS.2023.3284760 (2023)	https://doi.org/10.1016/j.compag.2021.106379 (2021)	The 'apple disease dataset' is used for training and evaluating CNN models to localize diseases in apples, aiming to achieve high mAP scores across multiple disease classes. It also supports data augmentation techniques such as center zoom, random cropping, zooming, and contrast stretching to enhance detection accuracy. This dataset enables researchers to improve the precision and robustness of disease localization models.; The 'apple disease dataset' is used to train and evaluate CNN models for apple disease localization, aiming to achieve high mAP scores across multiple disease classes. It also supports data augmentation techniques such as center zoom, random cropping, zooming, and contrast stretching to enhance detection accuracy. This dataset enables researchers to improve the precision and robustness of disease identification in apples.		
cited_context	apple leaf image dataset	https://doi.org/10.3389/fpls.2022.1002312 (2022)	https://doi.org/10.1016/j.compag.2019.105146 (2020)	The apple leaf image dataset, comprising 2,462 images, is used to train and evaluate DenseNet-121 for identifying six types of apple leaf diseases. This dataset supports research into plant disease diagnosis using deep learning, enabling the development and assessment of models that can accurately classify different disease states in apple leaves.		
citing_context	Apple Orchards diseases	https://doi.org/10.1007/978-3-031-06430-2_32 (2022)	https://doi.org/10.1002/aps3.11390 (2020)	The Apple Orchards diseases dataset is used for disease classification and segmentation, specifically employing a subset of 142 annotated images. Researchers use these detailed annotations to improve the accuracy of disease classification models. The dataset's annotated segmentation features enable more precise training and evaluation of machine learning algorithms focused on identifying and segmenting disease symptoms in apple orchards.		
cited_context	Apple's leaf dataset	https://doi.org/10.1007/s11831-021-09588-5 (2021)	https://doi.org/10.1109/ICTS.2019.8850964 (2019)	The Apple's leaf dataset is used to train and evaluate machine learning models, including CNN, InceptionV3, and VGG16, for identifying apple leaf diseases. Research focuses on comparing model performance and accuracy, enabling advancements in automated disease diagnosis. The dataset's relevance lies in its application for improving the precision of disease identification in apple leaves.		
cited_context	augmented field dataset	https://doi.org/10.14569/ijacsa.2022.0130484 (2022)	https://doi.org/10.1155/2020/8812019 (2020)	The augmented field dataset is used to train and evaluate disease detection models, specifically for improving accuracy in tomato leaf disease classification. Researchers focus on feature extraction and parameter tuning to enhance model performance. This dataset enables the development of more reliable disease detection systems by providing a robust set of images for training and testing.		
cited_context	Author-defined dataset	https://doi.org/10.3390/s21144749 (2021)	https://doi.org/10.1016/J.COMPAG.2018.04.002 (2019)	The author-defined dataset, comprising 8178 images, is used to train and evaluate a ResNet50 model for classifying wheat diseases, specifically Septoria, Tan Spot, and Rust. This dataset enables researchers to develop and test machine learning models for accurate disease classification, enhancing precision in agricultural diagnostics.		
cited_context	banana leaf dataset	https://doi.org/10.1109/ICDT61202.2024.10489081 (2024)	https://doi.org/10.1109/ICECAA58104.2023.10212347 (2023)	The banana leaf dataset is used for fine-tuning a hybrid CNN-LSTM model to classify disease severity on banana leaves. Researchers modify model weights to enhance accuracy, focusing on the specific characteristics of the dataset to improve the model's performance in disease severity classification.		
cited_context	BananaLSD	https://doi.org/10.1109/AIIoT58432.2024.10574771 (2024)	https://doi.org/10.1016/j.dib.2023.109608 (2023)	The BananaLSD dataset is used to classify banana leaf diseases through machine learning techniques, specifically focusing on the categorization of various illnesses affecting banana leaves. This dataset enables researchers to develop and validate models that accurately identify different types of leaf diseases, enhancing disease management and crop health monitoring.		
citing_context	bean leaf diseases dataset	https://doi.org/10.1109/RAEEUCCI57140.2023.10134461 (2023)	https://doi.org/10.1109/ACCESS.2022.3142817 (2022)	The bean leaf diseases dataset is used to classify bean leaf diseases using MobileNet models, focusing on disease identification through deep learning architecture. This dataset enables researchers to develop and test algorithms for accurate disease classification, contributing to the field of plant disease diagnosis.		
cited_context	Beans Disease Dataset	https://doi.org/10.1007/s10462-023-10517-0 (2023)	https://doi.org/10.1109/ACCESS.2019.2907383 (2019)	The Beans Disease Dataset is primarily used for classifying plant leaf diseases across various crops, including beans, soybeans, cucumbers, and mangoes, among others. It supports the development and evaluation of machine learning and deep learning models, particularly focusing on image-based diagnosis methods. The dataset is utilized to improve diagnostic accuracy, identify specific disease types, and enhance real-time disease detection. It often involves multilayer convolutional neural networks and ensemble approaches, and is sometimes expanded by subdividing images to increase dataset size. The dataset's high-resolution images and diverse disease categories enable robust training and testing of models for plant health monitoring and disease management.		
cited_context	Bell-pepper custom dataset	https://doi.org/10.3390/agriculture13020510 (2023)	https://doi.org/10.1007/s11760-021-02024-y (2021)	The Bell-pepper custom dataset is used to train and evaluate a YOLOv5 model for detecting diseases in bell pepper plants, specifically focusing on leaf-based symptoms. This dataset enables researchers to classify and identify various diseases by leveraging deep learning techniques, enhancing the accuracy of disease diagnosis in agricultural settings.		
cited_context	Black Gram Plant Leaf Disease dataset	https://doi.org/10.58190/icat.2023.9 (2023)	https://doi.org/10.1109/ICIT52682.2021.9491783 (2021)	The Black Gram Plant Leaf Disease dataset is used to train and evaluate the EfficientNet-B0 model for the precise identification and classification of various diseases in black gram plant leaves. This dataset enables researchers to develop and test machine learning algorithms that can accurately diagnose leaf diseases, enhancing agricultural management and crop health monitoring.		
citing_context	BPLD	https://doi.org/10.1109/ICCIT60459.2023.10441146 (2023)	https://doi.org/10.58190/icat.2023.9 (2023)	The BPLD dataset is used to evaluate deep learning models for classifying black gram plant leaf diseases, with a focus on assessing model performance and accuracy. This dataset enables researchers to test and compare different deep learning approaches, ensuring robust classification of plant diseases.		
cited_context	BRACOL	https://doi.org/10.1109/ICOSEC54921.2022.9951943 (2022)	https://doi.org/10.1007/978-3-319-24574-4_28 (2015)	The BRACOL dataset is used for image segmentation and classification of coffee leaves to diagnose diseases. Research focuses on evaluating precision, recall, and F1 score, employing methodologies that enhance the accuracy of disease diagnosis through image analysis. This dataset enables researchers to develop and test algorithms that improve the identification and management of plant diseases in coffee crops.		
cited_context	cassava leaf disease dataset	https://doi.org/10.1111/exsy.12746 (2021)	https://www.semanticscholar.org/paper/a6cb366736791bcccc5c8639de5a8f9636bf87e8 (2014)	The cassava leaf disease dataset is used to train neural networks for diagnosing cassava leaf diseases. Specifically, it employs the Adam optimizer with a piecewise learning rate schedule over 10 epochs. This dataset enables researchers to develop and refine machine learning models that can accurately identify various cassava leaf diseases, enhancing agricultural productivity and disease management.		
citing_context	Cassava Leaf Disease Classification dataset	https://doi.org/10.1109/LA-CCI58595.2023.10409445 (2023)		The Cassava Leaf Disease Classification dataset is primarily used to train and evaluate machine learning models for recognizing and diagnosing plant diseases. It focuses on visual symptoms in various plant parts, particularly cassava leaves, but also includes diseases affecting other plant species like mango. The dataset enables researchers to develop and test models that can accurately identify a wide range of plant diseases, enhancing disease management and crop health monitoring.		
