Analysis_Source	Name (extracted)	Citing Article	Citied Article	Features	Name_Variants	Homepage_URL
cited_context	Potato Leaf Dataset (PLD)	https://doi.org/10.3390/ELECTRONICS10172064 (2021)	https://doi.org/10.1109/ComPE49325.2020.9200015 (2020)	The Potato Leaf Dataset (PLD) is primarily used to train and evaluate models for detecting potato leaf diseases, specifically early blight and late blight. Researchers employ image segmentation and deep learning techniques, including CNNs and SVMs, to achieve high accuracy in disease classification. The dataset includes labeled images of diseased and healthy leaves, enabling robust model training and evaluation.		
citing_context	private and public datasets of tomato leaf images	https://doi.org/10.51983/ajcst-2023.12.2.3735 (2023)	https://doi.org/10.4081/jae.2022.1432 (2022)	The dataset 'private and public datasets of tomato leaf images' is mentioned in research citations but lacks detailed descriptions of its usage. There is no explicit evidence of its application in plant disease diagnosis, pest detection, or any specific methodologies or research questions. The dataset's role and impact in research are not clearly defined based on the provided information.		
cited_context | citing_context	Public dataset	https://doi.org/10.34133/plantphenomics.0054 (2023), https://doi.org/10.1155/2022/2845320 (2022), https://doi.org/10.1109/ACCESS.2024.3428553 (2024), https://doi.org/10.3390/app12125919 (2022)	https://doi.org/10.3389/fpls.2016.01419 (2016), https://doi.org/10.1145/3065386 (2012)	The dataset of 54,305 diseased and healthy plant leaf images is used to train Convolutional Neural Networks (CNNs) for identifying 26 diseases in 14 plant species. Collected under controlled conditions, these high-quality images enable robust machine learning models for accurate disease classification. This approach supports research in automated plant disease diagnosis, enhancing agricultural monitoring and management systems.; The public dataset is used to train and evaluate deep convolutional neural networks (CNNs), specifically AlexNet and GoogLeNet, for plant disease diagnosis. It focuses on image classification tasks, enabling the identification of 14 crop species and 26 diseases with high accuracy. The dataset supports research in image-based diagnosis methods, enhancing the precision of disease detection from leaf images.	public dataset of 54,305 diseased and healthy plant leaf images	
cited_context	publicly available dataset of the bell pepper plant	https://doi.org/10.3390/s21144749 (2021)	https://doi.org/10.1109/PDGC50313.2020.9315821 (2020)	The publicly available dataset of the bell pepper plant is used to train and evaluate deep learning models for disease classification. Research focuses on assessing model performance and accuracy in identifying diseases in bell pepper plants. This dataset enables researchers to develop and refine algorithms that can accurately diagnose plant diseases, contributing to improved agricultural practices and plant health management.		
cited_context	PV dataset	https://doi.org/10.1007/s10462-023-10517-0 (2023)	https://doi.org/10.1080/22797254.2017.1391054 (2018)	The PV dataset is used to train, evaluate, and validate deep learning models for plant disease diagnosis, focusing on improving detection accuracy. It is applied to various crops, including potatoes, grapes, soybeans, tomatoes, and strawberries, using architectures like MobileNetV2, AlexNet, GoogleNet, and PLSDA. Research emphasizes optimizing model parameters, such as batch size and iterations, and employing attention mechanisms and preprocessing techniques to enhance classification performance.		
cited_context | citing_context	PVD	https://doi.org/10.1109/ACCESS.2023.3284760 (2023)	https://doi.org/10.1080/14693062.2022.2085650 (2022), https://doi.org/10.1016/J.COMPIND.2019.02.003 (2019)	The PVD dataset is used for evaluating and training machine learning models, specifically CNNs, for diagnosing plant diseases through image analysis. It contains 87,867 photos and has been utilized to test spatially pyramid-oriented and eight-layered CNN methods, achieving high accuracy rates, particularly in diagnosing tomato diseases. The dataset's large size and focus on image-based detection enable robust model training and evaluation.; The PVD dataset is used to evaluate and demonstrate the diagnostic accuracy of deep learning models for plant disease diagnosis. Specifically, it has been employed to achieve high accuracy rates (98.4% for tomatoes) using an eight-layered CNN for image feature extraction and disease classification. It also supports the evaluation of spatially pyramid-oriented CNN methods for diagnosing cucumber and corn diseases, utilizing a large dataset of 87,867 photos. This dataset enables researchers to test and validate the effectiveness of various CNN architectures in accurately classifying plant diseases from images.		
cited_context | citing_context	PVD 54,306 images	https://doi.org/10.1109/ACCESS.2023.3284760 (2023)	https://doi.org/10.1016/J.JAFR.2021.100154 (2021)	The PVD 54,306 images dataset is used to train and evaluate a fine-tuned VGG16 model for recognizing early blight and late blight diseases on potato leaves. This dataset enables researchers to achieve high accuracy (96%) in disease recognition, facilitating advancements in plant disease diagnosis through machine learning techniques.; The PVD 54,306 images dataset is used to train and evaluate a fine-tuned VGG16 model for recognizing early blight and late blight diseases on potato leaves. This dataset enables researchers to achieve high accuracy (96%) in disease recognition, facilitating advancements in plant disease diagnosis through deep learning techniques.		
cited_context	Real environment Wheat	https://doi.org/10.3390/plants8110468 (2019)	https://doi.org/10.1016/J.COMPAG.2018.04.002 (2019)	The 'Real environment Wheat' dataset is used to train and evaluate deep learning models, specifically DCNN and ResNet-50, for wheat disease classification. It focuses on assessing model accuracy and balanced accuracy in real-world conditions. Despite its name, it has also been applied to cucumber disease classification using GPDCNN models, highlighting its versatility in plant disease research.		
cited_context	Real-field images	https://doi.org/10.1155/2022/3287561 (2022)	https://doi.org/10.25081/JP.2019.V11.5476 (1970)	The 'Real-field images' dataset is used to train and evaluate KNN and ANN models for detecting blast disease in South Indian rice crops. It focuses on enhancing model accuracy and assessing real-world applicability, providing researchers with a practical tool to improve disease diagnosis in agricultural settings.		
cited_context	real-time dataset for analysis of tomato leaf diseases and pests	https://doi.org/10.1007/s11042-022-14004-6 (2022)	https://doi.org/10.1109/ACCESS.2019.2914929 (2019)	The real-time dataset for analysis of tomato leaf diseases and pests is primarily used to develop and test real-time detection methods for plant diseases and pests, specifically focusing on tomato and apple leaves. Researchers employ deep learning models, such as INAR-SSD and convolutional neural networks, to improve the accuracy and speed of disease identification. The dataset's real-time nature and high-resolution images enable rapid and precise diagnostic capabilities, enhancing the effectiveness of disease management strategies.		
cited_context	remote sensing images	https://doi.org/10.1109/ACCESS.2024.3358333 (2024)	https://doi.org/10.1109/LGRS.2023.3244324 (2023)	The remote sensing images dataset is used to analyze Rice Blast disease through deep learning models, focusing on image-based diagnostics and pattern recognition in agricultural settings. This dataset enables researchers to develop and test algorithms that can accurately identify disease patterns, enhancing early detection and management strategies in rice cultivation.		
cited_context	Rice dataset	https://doi.org/10.1109/ACCESS.2023.3284760 (2023)	https://doi.org/10.1016/j.compag.2020.105652 (2020)	The Rice dataset is used to study rice classes through images taken in natural field conditions, provided by the Bangladesh Rice Research Institute. It focuses on plant classification and image analysis, employing methodologies that involve analyzing visual data to distinguish between different rice varieties. This dataset enables researchers to develop and validate algorithms for accurate rice classification, contributing to agricultural research and crop management.		
cited_context	rice crop stem images	https://doi.org/10.1007/s00521-023-08693-9 (2023)	https://doi.org/10.1016/j.neucom.2017.06.023 (2017)	The 'rice crop stem images' dataset is used to identify rice diseases through deep convolutional neural networks, specifically focusing on stem images captured in natural environments. This dataset enables researchers to develop and test machine learning models for disease identification, enhancing the accuracy of disease diagnosis in rice crops.		
cited_context	rice diseases image database	https://doi.org/10.1109/ACCESS.2024.3358333 (2024)	https://doi.org/10.1016/j.neucom.2017.06.023 (2017)	The rice diseases image database is used to train and evaluate deep convolutional neural networks for identifying rice diseases, particularly focusing on leaf and stem lesions. This dataset enables researchers to develop and test models that can accurately diagnose specific disease symptoms, enhancing the precision of disease identification in rice plants.		
citing_context	rice-leaf disease dataset from UCI	https://doi.org/10.1109/ICACCTech65084.2024.00028 (2024)	https://doi.org/10.12928/TELKOMNIKA.V19I2.16488 (2020)	The rice-leaf disease dataset from UCI is used to evaluate the performance of an extreme gradient boosting decision tree ensemble, specifically focusing on the accuracy of classifying rice leaf diseases. This dataset enables researchers to assess and improve machine learning models for disease classification, contributing to more effective agricultural management practices.		
cited_context	Rice Leaf Diseases Data Set	https://doi.org/10.1186/s13007-021-00722-9 (2021)	https://doi.org/10.3233/IDT-170301 (2017)	The Rice Leaf Diseases Data Set is used to detect and classify specific rice plant diseases, including Bacterial leaf blight, Brown spot, and Leaf smut. Each disease category contains 40 images captured under controlled conditions. Researchers employ this dataset to develop and validate machine learning models for disease classification, enhancing the accuracy of disease identification in rice plants.		
cited_context	Rice plant dataset	https://doi.org/10.1007/s10462-023-10517-0 (2023), https://doi.org/10.1109/ACCESS.2022.3141371 (2022)	https://doi.org/10.1016/j.inpa.2019.10.003 (2020)	The Rice plant dataset is primarily used to train and evaluate image-based models for diagnosing plant diseases, particularly in rice and cassava plants. It supports the development of classification models, focusing on handling class imbalance and optimizing image quality from various sources like smartphones and digital cameras. The dataset's comprehensive nature and diverse image characteristics enable researchers to test and improve the accuracy of disease detection algorithms, including deep residual convolutional neural networks.		
citing_context	rice plant image dataset	https://doi.org/10.32604/iasc.2022.020679 (2022), https://doi.org/10.51239/jictra.v12i2.306 (2022)	https://doi.org/10.3233/IDT-170301 (2017)	The rice plant image dataset is used for validating the detection and classification of rice plant diseases through image-based diagnostics and machine learning approaches. Specifically, it supports the prediction of three rice diseases using a deep convolutional neural network, classifying healthy and diseased rice plant leaves. With over 4000 images, the dataset enables robust training and testing of models for disease classification.		
cited_context	RoCoLe	https://www.semanticscholar.org/paper/b74461a923beb76a5fd18f08cae4291bd4ef3127 (2023)	https://doi.org/10.1016/j.dib.2019.104414 (2019)	The RoCoLe dataset is used to evaluate machine learning methods for recognizing plant diseases, particularly in robusta coffee leaf images. It includes both healthy and diseased states, enabling researchers to assess the accuracy and effectiveness of disease recognition algorithms. This dataset supports the development and testing of models aimed at improving disease diagnosis in agricultural settings.		
cited_context	Self-generated database	https://doi.org/10.3390/agronomy12102395 (2022)	https://doi.org/10.3390/s17092022 (2017)	The self-generated database is used to train and evaluate a deep-learning-based detector for real-time recognition of tomato plant diseases and pests. This dataset enables researchers to achieve 85% precision in identifying specific conditions, facilitating the development of accurate and efficient diagnostic tools. The dataset's focus on real-time recognition enhances its applicability in practical agricultural settings.		
cited_context	Sentinel-2	https://doi.org/10.3390/agriculture13020510 (2023)	https://doi.org/10.1109/IGARSS.2019.8898076 (2019)	The Sentinel-2 dataset is used for olive tree stress detection, employing satellite imagery to identify stress indicators rapidly and accurately. This methodology focuses on analyzing spectral bands to detect changes in vegetation health, enabling researchers to monitor and manage olive groves more effectively. The high-resolution and frequent revisit times of Sentinel-2 imagery are crucial for timely stress identification.		
citing_context	Sentinel-2 MSI imagery	https://doi.org/10.3390/plants14132082 (2025)	https://doi.org/10.3389/fpls.2022.1029529 (2022)	The Sentinel-2 MSI imagery dataset is used to monitor cotton aphids through ratio spectroscopy and a random forest algorithm, achieving 80% classification accuracy in pest detection. This methodology leverages the high-resolution spectral bands of the dataset to identify and classify pest infestations, enabling precise and timely management interventions in agricultural settings.		
cited_context	data set of 30000 images of pests	https://doi.org/10.1016/j.ecoinf.2021.101515 (2021)	https://doi.org/10.12928/TELKOMNIKA.V15I3.5382 (2017)	The dataset of 30,000 images of pests is used to train AlexNet, a deep convolutional neural network, for classifying 82 types of crop pests. This approach focuses on enhancing the accuracy of pest identification, leveraging the large and diverse image set to improve model performance in pest classification tasks.		
cited_context	small datasets (B 40 images)	https://doi.org/10.1007/s11831-018-9255-6 (2018)	https://doi.org/10.1016/J.COMPAG.2006.01.004 (2006)	The small dataset (B 40 images) is used to train and evaluate disease identification models, specifically for citrus disease detection. Researchers employ feedforward BPNN and statistical analysis of HSI to focus on small-scale image datasets. This dataset enables the development and testing of machine learning models tailored for limited data scenarios, enhancing the accuracy of disease identification in citrus plants.		
cited_context	Soybean 1280	https://doi.org/10.1080/02564602.2022.2121772 (2022)	https://doi.org/10.1007/s41870-020-00437-5 (2020)	The Soybean 1280 dataset is used to train and evaluate AlexNet for identifying soybean diseases, achieving 98% accuracy. It contains images of healthy and diseased soybean plants, enabling researchers to develop and test machine learning models for disease diagnosis. This dataset supports the advancement of automated disease detection methods in agricultural research.		
cited_context	Soybean Leaf Disease Dataset	https://doi.org/10.1007/s10462-023-10517-0 (2023)	https://doi.org/10.1007/s40030-019-00390-y (2019)	The Soybean Leaf Disease Dataset is primarily used to train and evaluate deep learning models for classifying soybean leaf diseases, enhancing diagnostic accuracy through image-based classification. It focuses on identifying various disease types using deep learning techniques, with some applications extending to hyperspectral image analysis for disease detection.		
cited_context	spectral reflectance characteristics	https://doi.org/10.1016/j.pbi.2019.06.007 (2019)	https://doi.org/10.1094/PHYTO-04-17-0128-R (2017)	The spectral reflectance characteristics dataset is used to link spectral patterns to early resistance reactions in barley against powdery mildew, specifically focusing on hypersensitive responses. This involves analyzing hyperspectral data to identify distinct spectral signatures associated with plant resistance mechanisms. The dataset enables researchers to detect and understand the early stages of plant defense responses, enhancing the precision of disease resistance studies.		
cited_context	standard plant village dataset	https://doi.org/10.1038/s41598-020-59108-x (2020)	https://doi.org/10.1007/978-3-030-00665-5_150 (2018)	The standard plant village dataset is used to classify grape crop diseases through transfer learning with AlexNet, focusing on the accuracy and performance of the model in disease diagnosis. This dataset enables researchers to evaluate and enhance machine learning models for precise disease identification in agricultural settings.		
cited_context	Stanford background dataset	https://doi.org/10.1155/2016/3289801 (2016)	https://doi.org/10.1109/ICCV.2009.5459211 (2009)	The Stanford background dataset is used to provide background images for training deep neural networks. Specifically, it enhances the ability of these networks to differentiate leaves from their surroundings, which is crucial for improving plant disease diagnosis or pest detection. This dataset enables researchers to focus on leaf-specific features by providing diverse and realistic background contexts, thereby improving the accuracy of diagnostic models.		
cited_context | citing_context	strawberry dataset	https://doi.org/10.1109/ACCESS.2023.3284760 (2023)	https://doi.org/10.1016/j.compag.2020.105446 (2019)	The strawberry dataset is used to test various neural network models for plant disease detection, specifically focusing on the accuracy and performance of these models in identifying diseases or pests in strawberries. This dataset enables researchers to evaluate and compare different machine learning approaches, enhancing the precision of disease and pest identification in agricultural settings.; The strawberry dataset is used to test various neural network models for plant disease diagnosis, specifically focusing on the accuracy and performance of these models in detecting diseases or pests in strawberries. This dataset enables researchers to evaluate and compare different machine learning approaches, enhancing the precision of disease and pest identification in strawberry plants.		
citing_context	Sugar beet leaf images dataset	https://doi.org/10.1155/2022/5862600 (2022)	https://doi.org/10.1016/j.physa.2019.122537 (2019)	The Sugar beet leaf images dataset is used to train and evaluate deep learning models, specifically Faster R-CNN and CNN, for detecting and classifying sugar beet leaf diseases and pests. Research focuses on improving disease detection accuracy and addressing challenges in distinguishing similar pests. Image augmentation techniques are applied to enhance model robustness.		
cited_context	Sugarcane Leaf images	https://www.semanticscholar.org/paper/06ace3a173b225a27bb7d4afbca4c00c2d3c1dff (2014)	https://www.semanticscholar.org/paper/540e133e6ddbb5b2f600b461aa20da42d156fc24 (2011)	The Sugarcane Leaf images dataset is used to measure leaf disease severity through image processing techniques. Researchers apply simple threshold and Triangle thresholding methods to segment leaf and lesion areas, enabling precise quantification of disease extent. This methodology supports studies focused on assessing and monitoring the impact of diseases on sugarcane crops.		
cited_context	Tea	https://doi.org/10.1109/ACCESS.2020.3021487 (2020)	https://doi.org/10.17632/DBJYFKN6JR.1 (2019)	The 'Tea' dataset is used for diagnosing diseases in tea leaves through 5-fold cross-validation, comparing metrics like accuracy, precision, recall, and F1 Score. It is also utilized to train a siamese network for low-shot learning, employing 200 epochs, a batch size of 8, and 50 batches, to identify tea leaf diseases effectively.		
cited_context	tea leaf diseases images	https://doi.org/10.1109/ACCESS.2021.3069646 (2021)	https://doi.org/10.1016/j.compag.2018.12.042 (2019)	The 'tea leaf diseases images' dataset is used to diagnose tea leaf diseases by combining the SLIC superpixel segmentation method with SVM classification. It focuses on 261 images representing 5 common diseases in complex backgrounds, enabling researchers to develop and test algorithms for accurate disease identification in tea leaves.		
cited_context	Tomato 10	https://doi.org/10.3390/app12146982 (2022)	https://doi.org/10.3390/electronics11060951 (2022)	The 'Tomato 10' dataset is used to train and evaluate AlexNet for the detection and classification of tomato leaf diseases. Research focuses on assessing the accuracy and performance of the model, leveraging the dataset's images to enhance disease recognition capabilities.		
cited_context	Tomato 4 4923	https://doi.org/10.3390/agriculture12010009 (2021)	https://doi.org/10.1109/TENCON.2018.8650088 (2018)	The 'Tomato 4 4923' dataset is used for deep learning-based tomato plant leaf disease detection and recognition. Researchers employ CNN and Faster R-CNN models to classify images and identify specific diseases. This dataset enables accurate image classification and disease identification, supporting advancements in automated plant health monitoring systems.		
citing_context	Tomato and Brinjal/Eggplant GLCM	https://doi.org/10.32996/jcsts.2023.5.3.6 (2023)	https://doi.org/10.1109/UBMK.2018.8566635 (2018)	The 'Tomato and Brinjal/Eggplant GLCM' dataset is used for plant leaf disease detection and classification. Researchers apply the Gray-Level Co-occurrence Matrix (GLCM) and adaptive neuro-fuzzy inference system to analyze texture features, enabling precise identification and categorization of diseases in tomato and brinjal/eggplant leaves. This methodology enhances the accuracy of disease diagnosis, supporting agricultural health management.		
citing_context	Tomato Late Blight dataset	https://doi.org/10.48129/kjs.v49i1.10586 (2021)		The Tomato Late Blight dataset is used to train and validate neural network models for diagnosing tomato late blight disease. It includes images at two resolutions (32x32 and 64x64 pixels), which are employed to evaluate model performance using metrics such as the Kappa coefficient and loss values. This dataset enables researchers to assess the effectiveness of different neural network architectures in disease diagnosis.		
cited_context | citing_context	Tomato Leaf	https://doi.org/10.1038/s41598-025-90487-1 (2025), https://doi.org/10.3390/s22020575 (2022)	https://doi.org/10.1016/j.measurement.2020.108650 (2020)	The tomato leaf dataset is used to evaluate the performance of methods for disease detection, achieving high accuracy rates (98.28% to 99%). It tests the robustness of models in complex background images and plant disease diagnosis contexts, focusing on the reliability of disease identification in varied conditions.; The Tomato Leaf dataset is used to train and evaluate FCNN and SCNN models for diagnosing plant diseases, specifically focusing on measuring stress levels due to nitrogen deficiency. This dataset enables researchers to develop and test machine learning models that can accurately identify and quantify the impact of nutrient deficiencies on tomato plants.	tomato leaf dataset	
cited_context	tomato leaf disease dataset	https://doi.org/10.1007/s11042-023-14994-x (2023)	https://doi.org/10.1007/978-3-319-11310-4_55 (2014)	The tomato leaf disease dataset is used to detect and classify two different viral diseases in tomato leaves. Researchers employ Support Vector Machine (SVM) methodology to focus on improving disease classification accuracy. This dataset enables precise identification of viral infections, enhancing the reliability of disease diagnosis in tomato plants.		
cited_context	Tomato leaf diseases dataset in AI CHALLENGER	https://doi.org/10.3390/app12125919 (2022)	https://doi.org/10.1109/ACCESS.2021.3058947 (2021)	The Tomato leaf diseases dataset in AI CHALLENGER is used to train and evaluate a restructured residual dense network for identifying tomato leaf diseases. Research focuses on improving accuracy and classification performance, utilizing the dataset's images to enhance model training and validation processes.		
cited_context	tomato plant disease dataset	https://doi.org/10.1016/j.compag.2019.105117 (2019)	https://doi.org/10.1109/CVPR.2017.632 (2016)	The tomato plant disease dataset is used to investigate the effectiveness of synthetic data augmentation and to evaluate generator architectural variants in diagnosing tomato plant diseases, particularly powdery mildew. Research focuses on performance metrics such as FID and NIMA, enhancing recognition systems and improving diagnostic accuracy.		
cited_context	Tomato Plant Village	https://doi.org/10.14569/ijacsa.2022.0130484 (2022)	https://doi.org/10.1088/1742-6596/1962/1/012024 (2021)	The 'Tomato Plant Village' dataset is used for classifying plant diseases through machine learning, specifically employing the Extreme Learning Machine (ELM) algorithm. This approach achieves an accuracy of 84%, enabling researchers to effectively diagnose plant diseases and understand the performance of ELM in agricultural applications.		
